<!ELEMENT branches (branch+)>
<!ELEMENT branch (name, address, phone, hours, map_link)>
<!ELEMENT name (#PCDATA)>
<!ELEMENT address (#PCDATA)>
<!ELEMENT phone (#PCDATA)>
<!ELEMENT hours (#PCDATA)>
<!ELEMENT map_link (#PCDATA)>
