<?xml version="1.0" encoding="UTF-8"?>
<!DOCTYPE branches SYSTEM "branches.dtd">
<branches>
    <branch>
        <name>Sydney CBD</name>
        <address>76 Devonshire St, Surry Hills NSW 2000</address>
        <phone>02 9211 1234</phone>
        <hours>Mon-Fri 6:00am-14:30pm, Sat-Sun 7:00am-15:00pm</hours>
        <map_link>https://maps.google.com/?q=76+Devonshire+St+Surry+Hills+NSW+2000</map_link>
    </branch>

    <branch>
        <name>Sydney CBD</name>
        <address>451 Pitt St, Haymarket NSW 2000</address>
        <phone>02 9262 5678</phone>
        <hours>Mon-Fri 6:00am-16:00pm, Sat-Sun 7:00am-15:00pm</hours>
        <map_link>https://maps.google.com/?q=451+Pitt+St+Haymarket+NSW+2000</map_link>
    </branch>

    <branch>
        <name>Sydney CBD</name>
        <address>31 Alfred St, Circular Quay NSW 2000</address>
        <phone>02 8971 9101</phone>
        <hours>Mon-Fri 6:30am-16:00pm, Sat-Sun 7:00am-15:00pm</hours>
        <map_link>https://maps.google.com/?q=31+Alfred+St+Circular+Quay+NSW+2000</map_link>
    </branch>
</branches>
